{
  "version": 2,
  "id": "m12-project-golden-v1",
  "corpusManifest": "fixtures/evaluation/m12/corpus-manifest.json",
  "curatedAt": "2026-09-04T00:00:00Z",
  "curator": "NodeRag project team",
  "synthetic": false,
  "sourcePlanningFiles": [
    "docs/planning/ARCHITECTURE.md",
    "docs/planning/IMPLEMENTATION.md",
    "docs/planning/M1-TESTBED-FEASIBILITY.md",
    "docs/planning/M2-REPOSITORY-THIN-SPK.md",
    "docs/planning/M3-IDENTITY-AUTHORIZATION.md",
    "docs/planning/M4-MARKDOWN-VERTICAL-SLICE.md",
    "docs/planning/M5-DURABLE-INGESTION-PURGE.md"
  ],
  "cases": [
    {
      "id": "md-001",
      "silo": "platform",
      "query": "Which project content is allowed to leave the NAS?",
      "queryClass": "semantic",
      "expectedFormat": "md",
      "answerable": true,
      "relevant": [{ "document": "corpus/platform-policy.md", "sha256": "25c8744c71e648929ce0c050385cc088f6c8057e1a49c347e47fa8929b73c24f" }]
    },
    {
      "id": "md-002",
      "silo": "platform",
      "query": "SEC-403",
      "queryClass": "error_code",
      "expectedFormat": "md",
      "answerable": true,
      "relevant": [{ "document": "corpus/platform-policy.md", "sha256": "25c8744c71e648929ce0c050385cc088f6c8057e1a49c347e47fa8929b73c24f" }]
    },
    {
      "id": "md-003",
      "silo": "platform",
      "query": "What is the PostgreSQL authorization backstop?",
      "queryClass": "exact_name",
      "expectedFormat": "md",
      "answerable": true,
      "relevant": [{ "document": "corpus/platform-policy.md", "sha256": "25c8744c71e648929ce0c050385cc088f6c8057e1a49c347e47fa8929b73c24f" }]
    },
    {
      "id": "md-004",
      "silo": "platform",
      "query": "\"Docker results are never presented as Package Center\"",
      "queryClass": "quoted_phrase",
      "expectedFormat": "md",
      "answerable": true,
      "relevant": [{ "document": "corpus/platform-policy.md", "sha256": "25c8744c71e648929ce0c050385cc088f6c8057e1a49c347e47fa8929b73c24f" }]
    },
    {
      "id": "md-005",
      "silo": "platform",
      "query": "Which search mode is the initial default?",
      "queryClass": "semantic",
      "expectedFormat": "md",
      "answerable": true,
      "relevant": [{ "document": "corpus/platform-policy.md", "sha256": "25c8744c71e648929ce0c050385cc088f6c8057e1a49c347e47fa8929b73c24f" }]
    },
    {
      "id": "md-006",
      "silo": "platform",
      "query": "ef_search 100",
      "queryClass": "exact_identifier",
      "expectedFormat": "md",
      "answerable": true,
      "relevant": [{ "document": "corpus/platform-policy.md", "sha256": "25c8744c71e648929ce0c050385cc088f6c8057e1a49c347e47fa8929b73c24f" }]
    },
    {
      "id": "md-007",
      "silo": "platform",
      "query": "List the five supported release formats.",
      "queryClass": "exact_name",
      "expectedFormat": "md",
      "answerable": true,
      "relevant": [{ "document": "corpus/platform-policy.md", "sha256": "25c8744c71e648929ce0c050385cc088f6c8057e1a49c347e47fa8929b73c24f" }]
    },
    {
      "id": "md-008",
      "silo": "platform",
      "query": "café canonical normalization",
      "queryClass": "unicode",
      "expectedFormat": "md",
      "answerable": true,
      "relevant": [{ "document": "corpus/platform-policy.md", "sha256": "25c8744c71e648929ce0c050385cc088f6c8057e1a49c347e47fa8929b73c24f" }]
    },
    {
      "id": "md-009",
      "silo": "platform",
      "query": "ローカル検索",
      "queryClass": "multilingual",
      "expectedFormat": "md",
      "answerable": true,
      "relevant": [{ "document": "corpus/platform-policy.md", "sha256": "25c8744c71e648929ce0c050385cc088f6c8057e1a49c347e47fa8929b73c24f" }]
    },
    {
      "id": "md-010",
      "silo": "platform",
      "query": "What can a search-only API key retrieve and what can it not download?",
      "queryClass": "semantic",
      "expectedFormat": "md",
      "answerable": true,
      "relevant": [{ "document": "corpus/platform-policy.md", "sha256": "25c8744c71e648929ce0c050385cc088f6c8057e1a49c347e47fa8929b73c24f" }]
    },
    {
      "id": "md-011",
      "silo": "platform",
      "query": "1200/200 and 3000/400",
      "queryClass": "exact_identifier",
      "expectedFormat": "md",
      "answerable": true,
      "relevant": [{ "document": "corpus/platform-policy.md", "sha256": "25c8744c71e648929ce0c050385cc088f6c8057e1a49c347e47fa8929b73c24f" }]
    },
    {
      "id": "md-012",
      "silo": "platform",
      "query": "Which identities are pinned by the nightly evaluation?",
      "queryClass": "semantic",
      "expectedFormat": "md",
      "answerable": true,
      "relevant": [{ "document": "corpus/platform-policy.md", "sha256": "25c8744c71e648929ce0c050385cc088f6c8057e1a49c347e47fa8929b73c24f" }]
    },
    {
      "id": "txt-001",
      "silo": "operations",
      "query": "GATE-5319",
      "queryClass": "exact_identifier",
      "expectedFormat": "txt",
      "answerable": true,
      "relevant": [{ "document": "corpus/operations-runbook.txt", "sha256": "1627058f3477a0623a287e9cb92a5919e54ce9d57e362e015ab310c1bf47c30f" }]
    },
    {
      "id": "txt-002",
      "silo": "operations",
      "query": "Which port does the public control interface use by default?",
      "queryClass": "exact_identifier",
      "expectedFormat": "txt",
      "answerable": true,
      "relevant": [{ "document": "corpus/operations-runbook.txt", "sha256": "1627058f3477a0623a287e9cb92a5919e54ce9d57e362e015ab310c1bf47c30f" }]
    },
    {
      "id": "txt-003",
      "silo": "operations",
      "query": "What mode is required for the private database directory?",
      "queryClass": "exact_identifier",
      "expectedFormat": "txt",
      "answerable": true,
      "relevant": [{ "document": "corpus/operations-runbook.txt", "sha256": "1627058f3477a0623a287e9cb92a5919e54ce9d57e362e015ab310c1bf47c30f" }]
    },
    {
      "id": "txt-004",
      "silo": "operations",
      "query": "How are model downloads resumed and made visible safely?",
      "queryClass": "semantic",
      "expectedFormat": "txt",
      "answerable": true,
      "relevant": [{ "document": "corpus/operations-runbook.txt", "sha256": "1627058f3477a0623a287e9cb92a5919e54ce9d57e362e015ab310c1bf47c30f" }]
    },
    {
      "id": "txt-005",
      "silo": "operations",
      "query": "REB-409",
      "queryClass": "error_code",
      "expectedFormat": "txt",
      "answerable": true,
      "relevant": [{ "document": "corpus/operations-runbook.txt", "sha256": "1627058f3477a0623a287e9cb92a5919e54ce9d57e362e015ab310c1bf47c30f" }]
    },
    {
      "id": "txt-006",
      "silo": "operations",
      "query": "Describe the ordered startup and shutdown process.",
      "queryClass": "semantic",
      "expectedFormat": "txt",
      "answerable": true,
      "relevant": [{ "document": "corpus/operations-runbook.txt", "sha256": "1627058f3477a0623a287e9cb92a5919e54ce9d57e362e015ab310c1bf47c30f" }]
    },
    {
      "id": "txt-007",
      "silo": "operations",
      "query": "What are the idle and active-ingest p95 limits?",
      "queryClass": "exact_identifier",
      "expectedFormat": "txt",
      "answerable": true,
      "relevant": [{ "document": "corpus/operations-runbook.txt", "sha256": "1627058f3477a0623a287e9cb92a5919e54ce9d57e362e015ab310c1bf47c30f" }]
    },
    {
      "id": "txt-008",
      "silo": "operations",
      "query": "When may Q4 replace Q8?",
      "queryClass": "semantic",
      "expectedFormat": "txt",
      "answerable": true,
      "relevant": [{ "document": "corpus/operations-runbook.txt", "sha256": "1627058f3477a0623a287e9cb92a5919e54ce9d57e362e015ab310c1bf47c30f" }]
    },
    {
      "id": "txt-009",
      "silo": "operations",
      "query": "What performance and quality conditions promote hybrid search?",
      "queryClass": "semantic",
      "expectedFormat": "txt",
      "answerable": true,
      "relevant": [{ "document": "corpus/operations-runbook.txt", "sha256": "1627058f3477a0623a287e9cb92a5919e54ce9d57e362e015ab310c1bf47c30f" }]
    },
    {
      "id": "txt-010",
      "silo": "operations",
      "query": "Does uninstall preserve indexed data by default?",
      "queryClass": "semantic",
      "expectedFormat": "txt",
      "answerable": true,
      "relevant": [{ "document": "corpus/operations-runbook.txt", "sha256": "1627058f3477a0623a287e9cb92a5919e54ce9d57e362e015ab310c1bf47c30f" }]
    },
    {
      "id": "txt-011",
      "silo": "operations",
      "query": "Which checks wait for the final DSM device test?",
      "queryClass": "semantic",
      "expectedFormat": "txt",
      "answerable": true,
      "relevant": [{ "document": "corpus/operations-runbook.txt", "sha256": "1627058f3477a0623a287e9cb92a5919e54ce9d57e362e015ab310c1bf47c30f" }]
    },
    {
      "id": "txt-012",
      "silo": "operations",
      "query": "Why must live PGDATA avoid Cloud Sync and media indexing?",
      "queryClass": "semantic",
      "expectedFormat": "txt",
      "answerable": true,
      "relevant": [{ "document": "corpus/operations-runbook.txt", "sha256": "1627058f3477a0623a287e9cb92a5919e54ce9d57e362e015ab310c1bf47c30f" }]
    },
    {
      "id": "docx-001",
      "silo": "platform",
      "query": "Which database and embedding model are packaged with NodeRag?",
      "queryClass": "semantic",
      "expectedFormat": "docx",
      "answerable": true,
      "relevant": [{ "document": "corpus/project-requirements.docx", "sha256": "ea6f096989f48dd4b0a5e56dc77b6f669d54715977edccac03e7511ec0bf2cee", "pages": [1] }]
    },
    {
      "id": "docx-002",
      "silo": "platform",
      "query": "ING-417",
      "queryClass": "error_code",
      "expectedFormat": "docx",
      "answerable": true,
      "relevant": [{ "document": "corpus/project-requirements.docx", "sha256": "ea6f096989f48dd4b0a5e56dc77b6f669d54715977edccac03e7511ec0bf2cee", "pages": [1] }]
    },
    {
      "id": "docx-003",
      "silo": "platform",
      "query": "plaaslike kennis bly op die NAS",